{
  "schema_version": 1,
  "id": "2099-01-03",
  "week_start": "2099-01-01",
  "week_end": "2099-01-03",
  "week_number": 999,
  "word_count": 700,
  "standfirst": "TEST DATA — NOT A REAL BRIEFING. This entry exists only to exercise the publish pipeline (schema validation, index rebuild, branch merge, Pages deploy). Every fact, name, citation and figure below is a placeholder. Delete this file when the check is done.",
  "orientation": "TEST DATA. Nothing on this page is a factual claim about the world. It is dated 2099 so it cannot be mistaken for a real week and cannot collide with a real digest slot. The synthetic content deliberately uses every enum value the schema allows — each `arc` type, each `attribution` status, each claim label, each `actor_type`, each `verdict` — so that a single test run touches every branch of the validator and every rendering path in the reader.",
  "housekeeping": "**This is a pipeline test, requested on 2026-08-31, not a briefing.**\n\nPurpose: confirm end-to-end that `scripts/build.mjs` validates, that `data/index.json` is rebuilt correctly, that the `claude/**` branch merges to `main` via `.github/workflows/publish.yml`, and that the site deploys to Pages.\n\nNo web research was performed. No real person, institution or document is described. Placeholder names (\"Example Institute\", \"Placeholder Ministry\") are used deliberately in place of real actors so that nothing here can be mistaken for reporting if it is seen on the live site.\n\n**To remove:** delete `data/digests/2099-01-03.json`, run `node scripts/build.mjs`, commit both that deletion and the rebuilt `data/index.json`. The site returns to the 2026-08-31 digest as its current week.",
  "pushback": {
    "target": "TEST — placeholder pushback target",
    "text": "TEST DATA. This field exists to check that the pushback block renders. It contains no argument about anything real."
  },
  "foundational": [
    {
      "phase": "TEST",
      "kind": "conceptual",
      "citation": {
        "author": "TEST — Placeholder Author",
        "year": 2099,
        "title": "TEST — placeholder title, not a real work",
        "venue": "TEST — placeholder venue",
        "locator": "0(0), pp. 0-0",
        "verification": "unverified",
        "verification_note": "TEST DATA. Deliberately unverified: this citation is fabricated for the pipeline test and must never be cited."
      },
      "summary": "TEST DATA — not a summary of any real work. This paragraph exists to confirm that section A renders a conceptual item with a citation block, a summary body and a critiques list.\n\nIt also checks that **markdown emphasis** and paragraph breaks survive the reader's formatting path.",
      "critiques": [
        "TEST — placeholder critique one.",
        "TEST — placeholder critique two."
      ]
    },
    {
      "phase": "TEST",
      "kind": "empirical",
      "citation": {
        "author": "TEST — Second Placeholder Author",
        "year": 2099,
        "title": "TEST — second placeholder title, not a real work",
        "venue": "TEST — placeholder venue",
        "verification": "partial",
        "verification_note": "TEST DATA. Set to 'partial' to exercise the second verification state."
      },
      "summary": "TEST DATA. Second foundational item, present to confirm that section A renders more than one entry and that the `partial` verification badge displays differently from `unverified`.",
      "critiques": [
        "TEST — placeholder critique."
      ]
    }
  ],
  "developments": [
    {
      "n": 1,
      "title": "TEST — placeholder development, novel arc",
      "date": "2099-01-01",
      "place": "Placeholder location",
      "scope": "global",
      "body": "TEST DATA. No event is being described. This item checks the `novel` arc value, the `no_study` attribution status, and a claims array carrying all four labels at once.",
      "arc": "novel",
      "arc_note": "TEST — placeholder arc note.",
      "attribution": {
        "status": "no_study",
        "note": "TEST — placeholder attribution note."
      },
      "claims": [
        { "label": "evidence", "text": "TEST — placeholder evidence claim." },
        { "label": "contested", "text": "TEST — placeholder contested claim." },
        { "label": "framing", "text": "TEST — placeholder framing claim." },
        { "label": "gap", "text": "TEST — placeholder gap claim." }
      ],
      "nl_eu": {
        "level": "none",
        "note": "TEST — placeholder note for the `none` level."
      },
      "dropped": "TEST — placeholder text confirming the `dropped` field renders.",
      "sources": [
        {
          "title": "TEST — placeholder source, not a real document",
          "publisher": "Example Institute",
          "date": "2099-01-01"
        }
      ]
    },
    {
      "n": 2,
      "title": "TEST — placeholder development, acceleration arc",
      "date": "2099-01-02",
      "scope": "multilateral",
      "body": "TEST DATA. Checks the `acceleration` arc, the `study_exists` attribution status and the `indirect` NL/EU level.",
      "arc": "acceleration",
      "arc_note": "TEST — placeholder named trend.",
      "attribution": {
        "status": "study_exists",
        "note": "TEST — placeholder note."
      },
      "claims": [
        { "label": "evidence", "text": "TEST — placeholder evidence claim with a source attached.", "source": { "title": "TEST — placeholder attached source", "publisher": "Example Institute" } }
      ],
      "nl_eu": {
        "level": "indirect",
        "note": "TEST — placeholder note for the `indirect` level."
      },
      "sources": [
        { "title": "TEST — placeholder source", "publisher": "Example Institute", "date": "2099-01-02" }
      ]
    },
    {
      "n": 3,
      "title": "TEST — placeholder development, repeat-accelerating arc",
      "date": "2099-01-02",
      "scope": "eu",
      "body": "TEST DATA. Checks the `repeat-accelerating` arc, `natural_variability` attribution and the `direct` NL/EU level.",
      "arc": "repeat-accelerating",
      "attribution": { "status": "natural_variability" },
      "claims": [
        { "label": "framing", "text": "TEST — placeholder framing claim." }
      ],
      "nl_eu": { "level": "direct", "note": "TEST — placeholder note for the `direct` level." },
      "sources": [
        { "title": "TEST — placeholder source", "publisher": "Placeholder Ministry" }
      ]
    },
    {
      "n": 4,
      "title": "TEST — placeholder development, repeat arc",
      "date": "2099-01-03",
      "scope": "nl",
      "body": "TEST DATA. Checks the `repeat` arc and the `none_claimed` attribution status.",
      "arc": "repeat",
      "attribution": { "status": "none_claimed", "note": "TEST — placeholder note." },
      "claims": [
        { "label": "gap", "text": "TEST — placeholder gap claim." }
      ],
      "nl_eu": { "level": "direct", "note": "TEST — placeholder note." },
      "sources": [
        { "title": "TEST — placeholder source", "publisher": "Placeholder Ministry" }
      ]
    },
    {
      "n": 5,
      "title": "TEST — placeholder development, standing-correction arc",
      "date": "2099-01-03",
      "scope": "other",
      "body": "TEST DATA. Final development. Checks the `standing-correction` arc, the `not_applicable` attribution status and the `other` scope value.",
      "arc": "standing-correction",
      "arc_note": "TEST — placeholder correction note.",
      "attribution": { "status": "not_applicable" },
      "claims": [
        { "label": "contested", "text": "TEST — placeholder contested claim." }
      ],
      "nl_eu": { "level": "none", "note": "TEST — placeholder note." },
      "sources": [
        { "title": "TEST — placeholder source", "publisher": "Example Institute" }
      ]
    }
  ],
  "salience": [
    {
      "jurisdiction": "Netherlands",
      "direction": "mixed",
      "direction_note": "TEST — placeholder direction note.",
      "claims": [
        { "label": "evidence", "text": "TEST — placeholder government claim. Not a statement about the Netherlands.", "actor_type": "government" },
        { "label": "evidence", "text": "TEST — placeholder public opinion claim.", "actor_type": "public_opinion" },
        { "label": "gap", "text": "TEST — placeholder private sector gap claim.", "actor_type": "private_sector" }
      ],
      "method_note": "TEST — placeholder method note, confirming this field renders.",
      "rests_on": ["D1"]
    },
    {
      "jurisdiction": "EU",
      "direction": "rising",
      "direction_note": "TEST — placeholder direction note.",
      "claims": [
        { "label": "evidence", "text": "TEST — placeholder government claim. Not a statement about the EU.", "actor_type": "government" },
        { "label": "framing", "text": "TEST — placeholder defence claim.", "actor_type": "defence" }
      ]
    },
    {
      "jurisdiction": "US",
      "direction": "falling",
      "direction_note": "TEST — placeholder direction note.",
      "claims": [
        { "label": "contested", "text": "TEST — placeholder government claim. Not a statement about the US.", "actor_type": "government" },
        { "label": "gap", "text": "TEST — placeholder private sector gap claim.", "actor_type": "private_sector" }
      ]
    },
    {
      "jurisdiction": "China",
      "direction": "no_change",
      "direction_note": "TEST — placeholder direction note, exercising `no_change`.",
      "claims": [
        { "label": "gap", "text": "TEST — placeholder claim. Not a statement about China.", "actor_type": "defence" }
      ]
    },
    {
      "jurisdiction": "India",
      "direction": "stable",
      "direction_note": "TEST — placeholder direction note, exercising `stable`.",
      "claims": [
        { "label": "evidence", "text": "TEST — placeholder claim. Not a statement about India.", "actor_type": "government" }
      ]
    },
    {
      "jurisdiction": "Multilateral",